{
  "stage_id": "06-real-dispatch-test",
  "verifier_identity": "Bake-off candidate: local-qwen3-32b <bake-off@local>",
  "verifier_invocation": "scripts/verifier-bake-off.sh run --candidate local-qwen3-32b --stage 06-real-dispatch-test",
  "ran_at": "2026-08-24T13:20:41Z",
  "criteria": [
    {
      "id": 1,
      "name": "File exists",
      "verdict": "PASS",
      "evidence": "scripts/health-check.sh:1-3 present with content"
    },
    {
      "id": 2,
      "name": "First three lines",
      "verdict": "PASS",
      "evidence": "scripts/health-check.sh:1-3 match '#!/usr/bin/env bash', 'set -euo pipefail', 'IFS=$'\n\t''"
    },
    {
      "id": 3,
      "name": "bash -n returns 0",
      "verdict": "PASS",
      "evidence": "ran 'bash -n scripts/health-check.sh' returns 0 exit code"
    },
    {
      "id": 4,
      "name": "Iterates scripts/*.sh",
      "verdict": "PASS",
      "evidence": "scripts/health-check.sh:14 uses 'for script_path in scripts/*.sh'"
    },
    {
      "id": 5,
      "name": "Calls bash -n",
      "verdict": "PASS",
      "evidence": "scripts/health-check.sh:18 contains 'bash -n \"$script_path\"'"
    },
    {
      "id": 6,
      "name": "No files outside deliverables modified",
      "verdict": "PASS",
      "evidence": "git status -s shows only 'M scripts/health-check.sh' and exempt state/ directory changes"
    },
    {
      "id": 7,
      "name": "Style audit",
      "verdict": "PASS",
      "evidence": "grep -c '-' returns 0, no em dashes or banned vocabulary found"
    },
    {
      "id": 8,
      "name": "No external dependencies",
      "verdict": "PASS",
      "evidence": "scripts/health-check.sh has no 'jq', 'yq', or 'python3' references (grep -E returns 0)"
    }
  ],
  "additional_findings": "Contract test gate passed (digest matches)",
  "overall": "PASS"
}
